{
  "metadata": {
    "command_name": "comparative_analysis_discover",
    "execution_timestamp": "2025-08-19T14:45:00.000000Z",
    "framework_phase": "DASV_Phase_1_Discovery",
    "companies_analyzed": ["TSLA", "NIO"],
    "comparison_methodology": "cross_sector_comparative_intelligence_framework",
    "analysis_scope": "cross_industry_comparison"
  },
  "comparative_company_intelligence": {
    "company_a_profile": {
      "ticker": "TSLA",
      "company_name": "Tesla, Inc.",
      "sector": "Consumer Cyclical",
      "industry": "Auto Manufacturers",
      "business_model": "Vertically integrated EV manufacturer with direct sales model, energy storage, and autonomous driving technology",
      "market_position": "Global EV market leader with premium positioning and strong brand recognition",
      "financial_health_grade": "A-",
      "revenue_ttm": 97690000000,
      "market_cap": 1081041813504,
      "current_price": 335.16,
      "profitability_status": "Profitable with strong margin expansion",
      "geographic_focus": "Global operations with manufacturing in US, China, and Europe",
      "confidence": 0.97
    },
    "company_b_profile": {
      "ticker": "NIO",
      "company_name": "NIO Inc.",
      "sector": "Consumer Cyclical",
      "industry": "Auto Manufacturers",
      "business_model": "Premium EV manufacturer with Battery-as-a-Service model, direct sales, and innovative charging infrastructure",
      "market_position": "Leading Chinese premium EV manufacturer with international expansion strategy",
      "financial_health_grade": "B-",
      "revenue_ttm": 67857653760,
      "market_cap": 10396670976,
      "current_price": 4.87,
      "profitability_status": "Loss-making but improving operational efficiency",
      "geographic_focus": "China-focused with European expansion",
      "confidence": 0.91
    },
    "comparative_assessment": {
      "business_model_differences": "Tesla operates vertically integrated manufacturing with global scale, while NIO focuses on innovative Battery-as-a-Service model and premium Chinese market positioning",
      "market_position_comparison": "Tesla holds global EV leadership with ~100x larger market cap, while NIO dominates Chinese premium EV segment with significant growth potential",
      "competitive_advantages": {
        "tesla_advantages": ["Global manufacturing scale", "Supercharger network", "Brand recognition", "Technology integration", "Profitability"],
        "nio_advantages": ["Battery-as-a-Service innovation", "Chinese market knowledge", "Government policy support", "Premium positioning in fastest-growing EV market"]
      },
      "strategic_positioning": "Tesla positioned as global technology leader with proven profitability, NIO positioned as innovative disruptor in world's largest EV market with unique business model differentiation"
    },
    "confidence": 0.94
  },
  "cross_sector_analysis": {
    "sector_characteristics": {
      "both_consumer_cyclical": "Both companies operate in Consumer Cyclical sector with high sensitivity to economic cycles and consumer spending patterns",
      "industry_positioning": "Auto Manufacturers industry experiencing historic transition to electric mobility with significant capital requirements",
      "technology_disruption": "Both positioned at intersection of automotive and technology sectors with autonomous driving and energy storage focus"
    },
    "industry_dynamics_comparison": {
      "market_maturity": "Tesla operates in mature US/EU markets while NIO focuses on rapidly expanding Chinese EV market",
      "competitive_intensity": "Tesla faces increasing competition from traditional automakers and new entrants, NIO competes in highly competitive Chinese premium segment",
      "regulatory_support": "Both benefit from government EV incentives, NIO has stronger direct policy support in China"
    },
    "regulatory_environment_comparison": {
      "tesla_regulatory": "Subject to US SEC reporting, automotive safety regulations, environmental standards across multiple jurisdictions",
      "nio_regulatory": "Chinese ADR structure with complex VIE regulations, PCAOB audit requirements, and potential US-China policy impacts"
    },
    "economic_sensitivity_comparison": {
      "interest_rate_sensitivity": "Both highly sensitive to interest rate changes - Tesla as growth stock with high valuation multiple, NIO as loss-making growth company",
      "economic_cycle_exposure": "Tesla has greater scale to weather downturns, NIO more exposed to Chinese economic cycles and policy changes",
      "currency_exposure": "Tesla has natural hedging through global operations, NIO exposed to USD/CNY exchange rate volatility"
    },
    "confidence": 0.93
  },
  "financial_metrics_comparison": {
    "profitability_comparison": {
      "tesla_profitability": {
        "net_income": 7130000000,
        "profit_margin": 0.0730,
        "gross_margin": 0.1786,
        "operating_margin": 0.0794,
        "status": "Consistently profitable with expanding margins"
      },
      "nio_profitability": {
        "net_income": -24290834432,
        "profit_margin": -0.358,
        "gross_margin": 0.015,
        "operating_margin": -0.430,
        "status": "Loss-making but improving operational efficiency"
      },
      "comparative_assessment": "Tesla demonstrates proven profitability model while NIO continues scaling toward profitability"
    },
    "liquidity_comparison": {
      "tesla_liquidity": {
        "cash_position": 36996001792,
        "current_ratio": 2.025,
        "free_cash_flow": 14923000000,
        "liquidity_strength": "Strong cash generation and position"
      },
      "nio_liquidity": {
        "cash_position": 5200000000,
        "current_ratio": 1.2,
        "free_cash_flow": 0,
        "liquidity_strength": "Adequate but limited cash flow generation"
      },
      "comparative_assessment": "Tesla's superior cash generation provides significant financial flexibility advantage"
    },
    "leverage_comparison": {
      "tesla_leverage": {
        "debt_to_equity": 0.1741,
        "debt_levels": "Conservative debt structure"
      },
      "nio_leverage": {
        "debt_to_equity": 0.975,
        "debt_levels": "Higher leverage reflecting growth stage financing"
      },
      "comparative_assessment": "Tesla maintains conservative capital structure while NIO uses higher leverage for growth financing"
    },
    "efficiency_comparison": {
      "tesla_efficiency": {
        "asset_turnover": "High manufacturing efficiency",
        "operational_leverage": "Strong operating leverage benefits"
      },
      "nio_efficiency": {
        "asset_turnover": 0.758,
        "operational_leverage": "Scaling operational efficiency"
      },
      "comparative_assessment": "Tesla demonstrates superior operational efficiency at scale"
    },
    "growth_comparison": {
      "tesla_growth": {
        "revenue_growth": 0.0947,
        "growth_sustainability": "Sustainable growth with profitability"
      },
      "nio_growth": {
        "revenue_growth": 0.215,
        "growth_sustainability": "High growth rate but requiring capital investment"
      },
      "comparative_assessment": "NIO shows higher growth rate reflecting earlier stage development, Tesla shows sustainable profitable growth"
    },
    "confidence": 0.96
  },
  "business_model_comparison": {
    "revenue_stream_analysis": {
      "tesla_revenue_streams": "Vehicle sales (primary), Energy generation/storage, Services, Regulatory credits",
      "nio_revenue_streams": "Vehicle sales (primary), Battery-as-a-Service subscriptions, Charging services, Autonomous driving software",
      "diversification_comparison": "Tesla has more mature revenue diversification, NIO innovating with subscription-based BaaS model"
    },
    "operational_model_comparison": {
      "tesla_model": "Vertically integrated manufacturing with direct sales, global gigafactory network, proprietary charging infrastructure",
      "nio_model": "Premium manufacturing with innovative battery swapping network, direct-to-consumer sales, integrated lifestyle ecosystem",
      "differentiation_factors": "Tesla focuses on manufacturing scale and integration, NIO on service innovation and premium experience"
    },
    "competitive_moat_analysis": {
      "tesla_moats": "Manufacturing scale, Supercharger network, technology integration, brand strength, first-mover advantage",
      "nio_moats": "Battery-as-a-Service innovation, Chinese market position, government relationships, premium brand in China",
      "moat_sustainability": "Tesla has deeper, more defensible moats globally; NIO has strong regional moats with innovation potential"
    },
    "scalability_assessment": {
      "tesla_scalability": "Proven global scalability with manufacturing expertise and technology platform",
      "nio_scalability": "Strong regional scalability potential with innovative business model requiring capital for international expansion",
      "scaling_risks": "Tesla faces increasing competition, NIO faces capital requirements and international expansion challenges"
    },
    "confidence": 0.92
  },
  "competitive_position_analysis": {
    "market_position_comparison": {
      "tesla_position": "Global EV market leader with premium positioning, strong brand recognition, and technology leadership",
      "nio_position": "Chinese premium EV market leader with innovative service model and strong domestic brand presence",
      "relative_strength": "Tesla has broader global reach and proven market position, NIO has strong regional dominance with growth potential"
    },
    "competitive_advantages_assessment": {
      "tesla_advantages": {
        "technology_leadership": "Advanced autonomous driving, battery technology, software integration",
        "manufacturing_scale": "Global gigafactory network with proven production efficiency",